Country,Town,Bank_Name,Bank_Phone_number,Bank_Address,Bank_Website,Reviewer_Name,Reviewer_Star,Reviewer_Text,Reviewer_Publish_Date,Reviewer_Like_Reaction,Reviewer_Profile_Link,Reviewer_Owner_Reply,Reviewer_Owner_Reply_Date
Uganda,Nebbi,Centenary Bank | Nebbi Branch,Not available,"F3HQ+986, Bishop Orombi Rd, Nebbi, Ouganda",Not available,Pascal Oriekot,3,NAN,il y a 2 ans,0,https://www.google.com/maps/contrib/103248822017789108690/reviews?hl=fr,NAN,NAN
Uganda,Nebbi,Centenary Bank | Nebbi Branch,Not available,"F3HQ+986, Bishop Orombi Rd, Nebbi, Ouganda",Not available,jacan jardine,4,NAN,il y a 7 ans,0,https://www.google.com/maps/contrib/110488892509931548680/reviews?hl=fr,NAN,NAN
Uganda,Nebbi,Centenary Bank | Nebbi Branch,Not available,"F3HQ+986, Bishop Orombi Rd, Nebbi, Ouganda",Not available,ONGORA DENIS,1,NAN,il y a 7 ans,0,https://www.google.com/maps/contrib/109924459887141262257/reviews?hl=fr,NAN,NAN
Uganda,Nebbi,Stanbic Bank | Nebbi Branch,+256 800 250250,"Nebbi - Zombo, Road, Ouganda",https://www.stanbicbank.co.ug/,Tripple Hope Watemu,2,"Stanbic Bank Nebbi m'a fait vivre la pire expérience que je n'oublierai pas, leur personnel est extrêmement très lent lorsqu'il sert au comptoir et le plus ennuyeux c'est que leur direction s'en fiche et le mieux est d'utiliser la banque Centenary pour aider je paie ces factures, je ne suis pas sûr qu'elles changeront un jour",il y a un an,9,https://www.google.com/maps/contrib/115076875017459011599/reviews?hl=fr,NAN,NAN
Uganda,Nebbi,Stanbic Bank | Nebbi Branch,+256 800 250250,"Nebbi - Zombo, Road, Ouganda",https://www.stanbicbank.co.ug/,JACK NATION (Mnager Romeocta Jack),3,Mais l'endroit n'est pas localisé avec précision,il y a 6 ans,1,https://www.google.com/maps/contrib/111620038632385575719/reviews?hl=fr,NAN,NAN
Uganda,Nebbi,Stanbic Bank | Nebbi Branch,+256 800 250250,"Nebbi - Zombo, Road, Ouganda",https://www.stanbicbank.co.ug/,jun guero,5,NAN,il y a 5 ans,0,https://www.google.com/maps/contrib/108474831469079389841/reviews?hl=fr,NAN,NAN
